联合,liánhé,alliance; to combine; to join; unite
立即,lìjí,immediately
智慧,zhìhuì,intelligence; intelligent; knowledge; wisdom
通常,tōngcháng,normal; normally; regular; usual; usually
反应,fǎnyìng,chemical reaction; reaction; reply; response; to react; to respond
资金,zījīn,funds; capital
表情,biǎoqíng,(facial) expression; to express one's feelings
英雄,yīngxióng,hero
系统,xìtǒng,system
人事,rénshì,(euphemism) sexuality; human affairs; human resources; personnel; the facts of life; ways of the world
时刻,shíkè,always; constantly; juncture; moment; period of time; time
充电器,chōngdiànqì,battery charger
抓紧,zhuājǐn,to keep a firm grip on; to lose no time in (doing sth); to pay close attention to
疯狂,fēngkuáng,crazy; frenzied; wild
轮流,lúnliú,to alternate; to take turns
服装,fúzhuāng,clothes; clothing; costume; dress
出示,chūshì,to display; to show; to take out and show to others
钓,diào,to fish with a hook and bait
幸运,xìngyùn,fortunate; fortune; luck; lucky
打交道,dǎjiāodào,to come into contact with; to have dealings
轻易,qīngyì,easily; lightly; rashly
制定,zhìdìng,to draw up; to formulate
后果,hòuguǒ,aftermath; consequences
悠久,yōujiǔ,long (tradition, history etc)
谈判,tánpàn,conference; negotiation; talks; to negotiate
营业,yíngyè,to do business; to trade
项目,xiàngmù,(sports) event; item; project
角度,jiǎodù,angle; point of view
挥,huī,to brandish; to command; to conduct; to disperse; to scatter; to wave
抽屉,chōuti,drawer
车库,chēkù,garage
胜利,shènglì,victory
吨,dūn,ton (loanword)
现实,xiànshí,actual; actuality; materialistic; pragmatic; real; realistic; reality; self-interested
关闭,guānbì,(of a shop, school etc) to shut down; to close; to shut (a window etc)
趁,chèn,to avail oneself of; to take advantage of
点心,diǎnxin,dessert; dim sum (in Cantonese cooking); light refreshments; pastry
去世,qùshì,to die; to pass away
强烈,qiángliè,strong; intense
痒,yǎng,to itch; to tickle
痒,yǎng,to itch; to tickle
本科,běnkē,undergraduate (attributive); undergraduate course
悄悄,qiāoqiāo,anxious; worried; quiet; making little or no noise; surreptitious; stealthy
保持,bǎochí,to hold; to keep; to maintain; to preserve
克服,kèfú,(try to) overcome (hardships etc); to conquer; to endure; to put up with
幸亏,xìngkuī,fortunately; luckily
看望,kànwàng,to pay a visit to; to see (sb)
豆腐,dòufu,bean curd; tofu
广场,guǎngchǎng,public square; plaza
爱惜,àixī,to cherish; to treasure; to use sparingly
疑问,yíwèn,doubt; interrogation; question
嗓子,sǎngzi,throat; voice
万一,wànyī,contingency; if by any chance; just in case
立刻,lìkè,at once; forthwith; immediate; prompt; promptly; straightway; thereupon
生产,shēngchǎn,to give birth to a child; to produce; to manufacture
初级,chūjí,junior; primary
始终,shǐzhōng,all along; from beginning to end
导致,dǎozhì,to bring about; to cause; to create; to lead to
省略,shěnglüè,an omission; to leave out
救护车,jiùhùchē,ambulance
优美,yōuměi,elegant; fine; graceful
人口,rénkǒu,people; population
叉子,chāzi,fork
窗帘,chuānglián,window curtains
顿,dùn,at once; classifier for meals, beatings, scoldings etc: time, bout, spell, meal; to arrange; to kowtow; to lay out; to pause; to stamp (one's foot); to stop
和平,Hépíng,Heping District of Shenyang city 瀋陽市|沈阳市[Shen3 yang2 shi4], Liaoning; Heping or Hoping Township in Taichung County 臺中縣|台中县[Tai2 zhong1 Xian4], Taiwan
和平,hépíng,peace; peaceful
情绪,qíngxù,mood; moodiness; state of mind
如今,rújīn,now; nowadays
移民,yímín,emigrant; immigrant; to immigrate; to migrate
改革,gǎigé,reform; to reform
宝贝,bǎobèi,baby; cowry; darling; good-for-nothing or queer character; treasure; treasured object
甲,jiǎ,(of the fingers or toes) nail; (used for an unspecified person or thing); ancient Chinese compass point: 75°; armor plating; bladed leather or metal armor (old); civil administration unit in the baojia 保甲[bao3 jia3] system (old); first (in a list, as a party to a contract etc); first of the ten Heavenly Stems 十天干[shi2 tian1 gan1]; letter "A" or roman "I" in list "A, B, C", or "I, II, III" etc; shell or carapace
诊断,zhěnduàn,to diagnose
夜,yè,night
批准,pīzhǔn,to approve; to ratify
猴子,hóuzi,monkey
录音,lùyīn,sound recording; to record (sound)
布,bù,to announce; to spread
布,bù,cloth; to announce; to declare; to make known; to spread
姑娘,gūniang,daughter; girl; paternal aunt (old); young lady; young woman
摆,bǎi,a pendulum; to arrange; to exhibit; to move to and fro
不然,bùrán,How about ...?; if not; no; not so; or else; otherwise
勇气,yǒngqì,courage; valor
杀,shā,(used after a verb) extremely; to attack; to kill; to murder; to smart (dialect); to weaken or reduce
公布,gōngbù,to announce; to make public; to publish
英俊,yīngjùn,handsome
了不起,liǎobuqǐ,amazing; extraordinary; terrific
军事,jūnshì,(attributive) military; military affairs
顶,dǐng,(slang) to "bump" a forum thread to raise its profile; apex; classifier for headwear, hats, veils etc; crown of the head; most; roof; to be subjected to (an aerial bombing, hailstorm etc); to carry on the head; to go against; to push to the top; to replace; to substitute; top
臭,chòu,bad; dud (ammunition); loathsome; repulsive; ruthlessly; severely; smelly; stench; terrible; to smell (bad)
臭,xiù,sense of smell; smell bad
集合,jíhé,(math.) set; to gather; to assemble
工业,gōngyè,industry
项,xiàng,back of neck; classifier for principles, items, clauses, tasks, research projects etc; item; sum (of money); term (in a mathematical formula); thing
因而,yīnér,and as a result, ...; as a result; therefore; thus
冷淡,lěngdàn,cold; indifferent
勿,wù,do not
吵,chǎo,noisy; to disturb by making a noise; to make a noise; to quarrel
妨碍,fángài,to hinder; to obstruct
破坏,pòhuài,damage; destruction; to break; to destroy; to wreck
评价,píngjià,to assess; to evaluate
开放,kāifàng,to be open (to the public); to be open-minded; to bloom; to open; to open up (to the outside); unconstrained in one's sexuality; unrestrained by convention
形象,xíngxiàng,figure; form; image; visualization; vivid
观点,guāndiǎn,point of view; standpoint; viewpoint
象棋,xiàngqí,Chinese chess
眉毛,méimao,eyebrow
分别,fēnbié,difference; distinction; in different ways; differently; separately; individually; to distinguish; to tell apart; to part; to leave each other
佩服,pèifú,to admire
汇率,huìlü,exchange rate
家乡,jiāxiāng,hometown; native place
名牌,míngpái,famous brand; name tag; nameplate
片面,piànmiàn,one-sided; unilateral
爱护,àihù,to cherish; to love and protect; to take care of; to treasure
业余,yèyú,amateur (historian etc); in one's spare time; outside working hours
发表,fābiǎo,to issue; to publish
居然,jūrán,go so far as to; to one's surprise; unexpectedly
盆,pén,basin; flower pot; unit of volume equal to 12 斗[dou3] and 8 升[sheng1], approx 128 liters
反正,fǎnzhèng,anyway; in any case; to come over from the enemy's side
报社,bàoshè,newspaper (i.e. a company)
嫁,jià,(of a woman) to marry; to marry off a daughter; to shift (blame etc)
猪,zhū,hog; pig; swine
精神,jīngshén,consciousness; essence; gist; mental; mind; psychological; spirit; thought
精神,jīngshen,drive; spiritual; vigor; vitality
运用,yùnyòng,to put to use; to use
不得了,bùdéliǎo,desperately serious; disastrous; exceedingly; extremely
承受,chéngshòu,to bear; to inherit; to support
分配,fēnpèi,to allocate; to assign; to distribute; to partition (a hard drive)
安装,ānzhuāng,installation; to erect; to fix; to install; to mount
据说,jùshuō,it is said that; reportedly
范围,fànwéi,extent; limit; range; scope
事实,shìshí,fact
到达,dàodá,to reach; to arrive
胡说,húshuō,drivel; to talk nonsense
外交,wàijiāo,diplomacy; diplomatic; foreign affairs
珍惜,zhēnxī,to cherish; to treasure; to value
抢,qiāng,(literary) to knock against (esp. to knock one's head on the ground in grief or rage); opposite in direction; contrary
抢,qiǎng,to fight over; to grab; to rob; to rush; to scramble; to snatch
整个,zhěnggè,entire; total; whole
键盘,jiànpán,keyboard
进口,jìnkǒu,entrance; imported; inlet (for the intake of air, water etc); to import
冻,dòng,aspic or jelly; to feel very cold; to freeze
往返,wǎngfǎn,to go back and forth; to go to and fro; to do a round trip
其余,qíyú,apart from them; remainder; remaining; the others; the rest
展览,zhǎnlǎn,exhibition; show; to exhibit; to put on display
糊涂,hútu,confused; muddled; silly
平静,píngjìng,serene; tranquil; undisturbed
圆,yuán,(of the moon) full; circle; circular; round; spherical; tactful; to make consistent and whole (the narrative of a dream or a lie); unit of Chinese currency (yuan)
发达,fādá,(literary) to achieve fame and fortune; to prosper; to develop; to promote; to expand; well-developed; flourishing
报到,bàodào,to check in; to register; to report for duty
毛病,máobìng,ailment; defect; fault; shortcomings
工程师,gōngchéngshī,engineer
背景,bèijǐng,(fig.) powerful backer; background; backdrop; context
概括,gàikuò,briefly; in broad outline; to summarize; to generalize
指导,zhǐdǎo,guidance; to coach; to direct; to give directions; to guide; tuition
飘,piāo,to float
一辈子,yībèizi,(for) a lifetime
模特,mótè,(fashion) model (loanword)
成语,chéngyǔ,Chinese set expression, typically of 4 characters, often alluding to a story or historical quotation; adage; idiom; proverb; saying
维修,wéixiū,maintenance (of equipment); to protect and maintain
损失,sǔnshī,damage; loss; to lose; to suffer damage
总算,zǒngsuàn,at long last; finally; on the whole
现象,xiànxiàng,appearance; phenomenon
胆小鬼,dǎnxiǎoguǐ,coward
干燥,gānzào,arid; desiccation; dull; to dry (of weather, paint, cement etc); uninteresting
翻,fān,to climb over or into; to cross; to decode; to double; to flip over; to overturn; to rummage through; to translate; to turn over
宿舍,sùshè,dorm room; dormitory; hostel; living quarters
尽快,jǐnkuài,as quickly as possible; as soon as possible
王子,wángzǐ,prince; son of a king
最初,zuìchū,at first; first; initial; initially; original; originally; primary
销售,xiāoshòu,sales (representative, agreement etc); to market; to sell
诗,shī,poem; poetry; verse
流传,liúchuán,to circulate; to hand down; to spread
功能,gōngnéng,function; capability
实验,shíyàn,experiment; experimental; test; to experiment
驾驶,jiàshǐ,to drive; to pilot (ship, airplane etc)
闻,wén,fame; famous; news; reputation; to hear; to smell; to sniff at; well-known
沙漠,shāmò,desert
咬,yǎo,to bite; to nip
方,fāng,classifier for square things; direction; fair and square; honest; just when; method; only or just; party (to a contract, dispute etc); place; power or involution (math.); prescription (medicine); side; square; upright
摇,yáo,to crank; to rock; to row; to shake
风俗,fēngsú,social custom
薄,báo,cold in manner; indifferent; infertile; light; thin; weak
薄,bó,frivolous; meager; slight; to approach or near; to belittle; to despise; to look down on; ungenerous or unkind; weak
提问,tíwèn,to question; to quiz; to grill
摘,zhāi,to borrow; to pick (flowers, fruit etc); to pluck; to remove; to select; to take; to take off (glasses, hat etc)
避免,bìmiǎn,to avert; to avoid; to prevent; to refrain from
光滑,guānghuá,glossy; sleek; smooth
胶水,jiāoshuǐ,glue
作文,zuòwén,composition (student essay); to write an essay
营养,yíngyǎng,nourishment; nutrition
集体,jítǐ,a group; a team; as a group; collective (decision); en masse; joint (effort)
直,Zhí,Zhi (c. 2000 BC), fifth of the legendary Flame Emperors 炎帝[Yan2 di4] descended from Shennong 神農|神农[Shen2 nong2] Farmer God
直,zhí,(indicates continuing motion or action); fair and reasonable; frank; straight; straightforward; to straighten; vertical; vertical downward stroke in Chinese characters
兑换,duìhuàn,to convert; to exchange
勤奋,qínfèn,diligent; hardworking
学历,xuélì,academic qualifications; educational background
怀孕,huáiyùn,gestation; pregnancy; pregnant; to have conceived
欣赏,xīnshǎng,to appreciate; to enjoy; to admire
培养,péiyǎng,culture (biology); education; fostering; to breed; to cultivate; to educate; to foster; to groom (for a position); to nurture
整齐,zhěngqí,even; neat; orderly; tidy
洞,dòng,cave; hole; zero (unambiguous spoken form when spelling out numbers)
宝贵,bǎoguì,precious; to set store by; to treasure; to value; valuable
人生,rénshēng,life (one's time on earth)
人民币,rénmínbì,Chinese Yuan (CNY); Renminbi (RMB)
公寓,gōngyù,apartment building; block of flats
振动,zhèndòng,to shake; to vibrate; vibration
煮,zhǔ,to boil; to cook
成熟,chéngshú,mature; ripe; to mature; to ripen
宣传,xuānchuán,propaganda; to disseminate; to give publicity to
断,duàn,decidedly; definitely; to break; to cut off; to give up or abstain from sth; to judge; to snap
交换,jiāohuàn,commutative (math); to commute; to exchange; to swap; to switch (telecom)
数,shǔ,to count; to count as; to regard as; to enumerate; to list
数,shù,number; figure; several; a few
数,shuò,(literary) frequently; repeatedly
总统,zǒngtǒng,president (of a country)
未来,wèilái,approaching; coming; future; pending; tomorrow
押金,yājīn,deposit; down payment
建筑,jiànzhù,building; to construct
合理,hélǐ,rational; reasonable; sensible; fair
追求,zhuīqiú,to pursue (a goal etc) stubbornly; to seek after; to woo
自豪,zìháo,proud (of one's achievements etc)
面对,miànduì,to face; to confront
义务,yìwù,duty; obligation; volunteer (work etc)
系,xì,department; faculty; system
系,xì,to be (literary); to bind; to connect; to relate to; to tie up
系,jì,to button up; to fasten; to tie
系,xì,to arrest; to connect; to worry
游览,yóulǎn,to go sightseeing; to tour; to visit
资源,Zīyuán,Ziyuan county in Guilin 桂林[Gui4 lin2], Guangxi
资源,zīyuán,natural resource (such as water or minerals); resource (such as manpower or tourism)
大型,dàxíng,large; large-scale
期间,qījiān,period; period of time; time; time period
好客,hàokè,friendly; hospitable; hospitality; to enjoy having guests; to treat guests well
提纲,tígāng,notes; outline; synopsis
硬,yìng,(fig.) strong; firm; (of food) filling; substantial; good (quality); able (person); hard; stiff; solid; laboriously; with great difficulty; resolutely; uncompromisingly
严肃,yánsù,earnest; grave; serious; severe; solemn
主持,zhǔchí,(TV) anchor; to host (a TV or radio program etc); to manage or direct; to preside over; to stand for (justice etc); to take charge of; to uphold
节省,jiéshěng,saving; to cut down on; to save; to use sparingly
柜台,guìtái,(of markets, medicines etc) OTC (over-the-counter); bar; front desk; sales counter
卧室,wòshì,bedroom
标志,biāozhì,logo; mark; sign; symbol; to indicate; to mark; to symbolize
雾,wù,fog; mist
及格,jígé,to meet a minimum standard; to pass an exam or a test
轻视,qīngshì,contempt; contemptuous; scornful; to despise; to scorn
业务,yèwù,business; professional work; service
活跃,huóyuè,active; excited; lively; to brighten up; to enliven
公元,gōngyuán,AD (Anno Domini); CE (Common Era); Christian Era
结论,jiélùn,conclusion; to conclude; to reach a verdict; verdict
套,tào,(fig.) to fish for; bend (of a river or mountain range, in place names); classifier for sets, collections; cover; formula; harness; loop of rope; sheath; tau (Greek letter Ττ); to copy; to cover; to encase; to interleave; to model after; to obtain slyly; to overlap
位于,wèiyú,to be located at; to be situated at; to lie
蝴蝶,húdié,butterfly
巨大,jùdà,enormous; gigantic; huge; immense; tremendous; very large
数码,shùmǎ,amount; digital; figures; number; numerals; numerical code
期待,qīdài,expectation; to await; to look forward to
招待,zhāodài,to hold a reception; to offer hospitality; to entertain (guests); to serve (customers)
平均,píngjūn,average; on average; evenly; in equal proportions
单独,dāndú,alone; by oneself; on one's own
私人,sīrén,a member of one's clique; interpersonal; personal; private; sb with whom one has a close personal relationship
恨,hèn,to hate; to regret
牙齿,yáchǐ,dental; tooth
纷纷,fēnfēn,continuously; diverse; in profusion; in succession; numerous and confused; one after another; one by one; pell-mell
对比,duìbǐ,contrast; ratio; to contrast
醉,zuì,intoxicated
日常,rìcháng,day-to-day; daily; everyday
对象,duìxiàng,partner; boyfriend; girlfriend; target; object
当地,dāngdì,local
总共,zǒnggòng,altogether; in sum; in all; in total
金属,jīnshǔ,metal
启发,qǐfā,enlightenment; motivation; revelation; to enlighten; to explain (a text etc); to stimulate (a mental attitude)
秘书,mìshū,secretary
制度,zhìdù,institution; system (e.g. political, adminstrative etc)
青,qīng,black; blue; green; young (of people); youth
可怕,kěpà,awful; dreadful; fearful; formidable; frightful; hideous; horrible; scary; terrible; terribly
捐,juān,(bound form) tax; levy; to contribute; to donate; to relinquish; to abandon
胃口,wèikǒu,appetite; liking
手续,shǒuxù,formalities; procedure
激烈,jīliè,(of a course of action) drastic; (of an expression of opinion) impassioned; (of competition or fighting) intense; (of pain) acute; extreme; fierce; vehement
成长,chéngzhǎng,growth; to grow; to mature
秩序,zhìxù,order (orderly); order (sequence); social order; the state (of society)
病毒,bìngdú,virus
颗,kē,classifier for small spheres, pearls, corn grains, teeth, hearts, satellites etc
发明,fāmíng,an invention; to invent
馒头,mántou,steamed bread; steamed bun; steamed roll
思考,sīkǎo,to ponder over; to reflect on
问候,wènhòu,(fig.) (coll.) to make offensive reference to (somebody dear to the person to whom one is speaking); to give one's respects; to send a greeting
遗憾,yíhàn,regret; to be sorry that; to regret
行人,xíngrén,official responsible for arranging audiences with the emperor; passer-by; pedestrian; traveler on foot
签,qiān,label; small wood sliver; tag
签,qiān,to sign one's name; to write brief comments on a document; visa
等于,děngyú,to be tantamount to; to equal
日用品,rìyòngpǐn,articles for daily use
夸张,kuāzhāng,(coll.) excessive; exaggerated; hyperbole; outrageous; overstated; ridiculous; to exaggerate
平等,píngděng,equal; equality
匹,pī,mate; one of a pair
匹,pǐ,classifier for cloth: bolt
匹,pǐ,classifier for cloth: bolt; classifier for horses, mules etc; horsepower; ordinary person
伟大,wěidà,huge; great; grand; worthy of the greatest admiration; important (contribution etc)
执照,zhízhào,license; permit
相对,xiāngduì,counterpart; opposite; relative; relatively; to oppose; to resist; vis-a-vis
面积,miànjī,area (of a floor, piece of land etc); surface area; tract of land
观察,guānchá,to observe; to watch; to survey
人类,rénlèi,human race; humanity; mankind
幻想,huànxiǎng,delusion; fantasy
限制,xiànzhì,limit; restriction; to confine; to limit; to restrict
观念,guānniàn,concept; general impressions; ideology; notion; sense; thought; views
舅舅,jiùjiu,maternal uncle (informal); mother's brother
休闲,xiūxián,idle; leisure; not working; relaxation; to enjoy leisure; to lie fallow
地毯,dìtǎn,carpet; rug
商品,shāngpǐn,commodity; goods; merchandise
记录,jìlù,note-taker; record (in sports etc); record (written account); to record
称赞,chēngzàn,to acclaim; to commend; to compliment; to praise
姥姥,lǎolao,(coll.) mother's mother; maternal grandmother
疼爱,téngài,to love dearly
名胜古迹,míngshènggǔjì,historical sites and scenic spots
措施,cuòshī,measure; step
救,jiù,to assist; to rescue; to save
相似,xiāngsì,similar; alike
存在,cúnzài,existence; to be; to exist
冰激凌,bīngjīlíng,ice cream
酱油,jiàngyóu,soy sauce
主题,zhǔtí,subject; theme
迟早,chízǎo,sooner or later
夸,kuā,to boast; to exaggerate; to praise
善良,shànliáng,good and honest; kindhearted
小气,xiǎoqì,miserly; narrow-minded; petty; stingy
借口,jièkǒu,excuse; pretext; to use as an excuse
地区,dìqū,area; as suffix to city name, means prefecture or county (area administered by a prefecture-level city or, county-level city); district (not necessarily formal administrative unit); local; region; regional
平,píng,calm; equal; flat; level; peaceful; to draw (score); to tie (make the same score)
沟通,gōutōng,to communicate; to join; to connect; to link up
形容,xíngróng,(literary) countenance; appearance; to describe
亿,yì,100 million
规矩,guīju,customs; fig. established standard; fig. upright and honest; lit. compass and set square; practices; rule; well-behaved
达到,dádào,to reach; to achieve; to attain
主人,zhǔrén,host; master; owner
围巾,wéijīn,scarf; shawl
形状,xíngzhuàng,form; shape
木头,mùtou,blockhead; log (of wood, timber etc); slow-witted
词汇,cíhuì,list of words (e.g. for language teaching purposes); vocabulary; word
完整,wánzhěng,complete; intact
成分,chéngfèn,composition; ingredient; element; component; one's social status
摄影,shèyǐng,photography; to shoot (a movie); to take a photograph
沙滩,shātān,beach; sandy shore
显示,xiǎnshì,to demonstrate; to display; to illustrate; to show
犹豫,yóuyù,to hesitate
正,zhēng,first month of the lunar year
正,zhèng,(math.) positive; exactly; just (at that time); main; principal; proper; right (in that place); straight; to correct; to rectify; upright
靠,kào,to come near to; to depend on; to fuck (vulgar); to lean against or on; to stand by the side of; to trust; traditional military costume drama where the performers wear armor (old)
梦想,mèngxiǎng,(fig.) to dream of; dream
独立,dúlì,independence; independent; to stand alone
歪,wǎi,to sprain (one's ankle) (Tw)
歪,wāi,(coll.) to lie on one's side; askew; at a crooked angle; devious; noxious
脖子,bózi,neck
池塘,chítáng,pond; pool
理论,lǐlùn,theory; to argue; to take notice of
翅膀,chìbǎng,wing
行动,xíngdòng,action; mobile; operation; to move about
骂,mà,to abuse; to curse; to scold
对手,duìshǒu,(well-matched) adversary; competitor; match; opponent; rival
温柔,wēnróu,gentle and soft; tender; sweet (commonly used to describe a girl or woman)
明星,míngxīng,star; celebrity
装饰,zhuāngshì,decoration; decorative; ornamental; to decorate
学术,xuéshù,academic; learning; science
油炸,yóuzhá,to deep fry
灰心,huīxīn,to be discouraged; to lose heart
鼓掌,gǔzhǎng,to applaud; to clap
必然,bìrán,certain; inevitable; necessity
陆地,lùdì,dry land (as opposed to the sea)
摔倒,shuāidǎo,to fall down; to slip and fall; to throw sb to the ground
刺激,cìjī,irritant; to provoke; to irritate; to upset; to stimulate; to excite
拐弯,guǎiwān,fig. a new direction; to go round a curve; to turn a corner
睁,zhēng,to open (one's eyes)
控制,kòngzhì,to control
出色,chūsè,remarkable; outstanding
透明,tòumíng,(fig.) transparent; open to scrutiny; transparent
天空,tiānkōng,sky
夹子,jiāzi,clamp; clip; folder; tongs; wallet
桃,táo,peach
闯,chuǎng,to break through; to charge; to dash; to rush; to temper oneself (through battling hardships)
状况,zhuàngkuàng,condition; state; situation
体贴,tǐtiē,considerate (of other people's needs)
总之,zǒngzhī,in a word; in brief; in short
资格,zīgé,qualifications; seniority
太极拳,tàijíquán,a martial art; shadowboxing or Taiji, T'aichi or T'aichichuan; traditional form of physical exercise or relaxation
落后,luòhòu,backward; to fall behind; to lag (in technology etc); to retrogress
辅导,fǔdǎo,to coach; to counsel; to give guidance; to mentor; to tutor
机器,jīqì,machine
逃,táo,to escape; to flee; to run away
欠,qiàn,(bound form) yawn; (literary) to be deficient in; to lack; to owe; to raise slightly (a part of one's body)
紧急,jǐnjí,emergency; urgent
接待,jiēdài,to receive; to entertain; to host (guests, visitors or clients)
退步,tuìbù,backward step; fallback; leeway; room to maneuver; setback; to do less well than before; to make a concession
熬夜,áoyè,to stay up late or all night
说服,shuōfú,to convince; to persuade; to talk sb over
治疗,zhìliáo,medical treatment; therapy; to treat (an illness)
钢铁,gāngtiě,steel
事物,shìwù,thing; object
嘉宾,jiābīn,esteemed guest; guest (on a show); honored guest
媒体,méitǐ,media, esp. news media
丝毫,sīháo,a bit; the slightest amount or degree
综合,zōnghé,composite; comprehensive; mixed; synthesized; to integrate; to sum up; to synthesize
近代,jìndài,(in the context of Chinese history) the period from the Opium Wars until the May 4th Movement (mid-19th century to 1919); capitalist times (pre-1949); modern times, excluding recent decades; the not-very-distant past
骨头,gǔtou,bitterness; bone; moral character
道德,dàodé,ethics; morality; virtue
非,fēi,(coll.) to insist on; simply must; non-; un-; in-; de-; to not be; not; to reproach; to blame; wrong; incorrect
应付,yìngfu,to cope; to deal with
改正,gǎizhèng,correction; to amend; to correct; to put right
晒,shài,(coll.) to give the cold shoulder to; (fig.) to expose and share (one's experiences and thoughts) on the Web (loanword from "share"); (of the sun) to shine on; to bask in (the sunshine); to dry (clothes, grain etc) in the sun
