痛快,tòngkuài,also pr. [tong4 kuai5]; delighted; straightforward; to one's heart's content
促使,cùshǐ,to actuate; to bring about; to catalyze; to contribute to (some development); to drive (sb to do sth); to impel; to induce; to promote; to provoke; to urge
冲,chōng,thoroughfare; to clash; to go straight ahead; to rush
冲,chòng,in view of; powerful; pungent; towards; vigorous
冲,chōng,(of water) to dash against; to clash; to collide with; to develop (a film); to flush; to infuse; to mix with water; to rinse; to rise in the air
哪怕,nǎpà,even; even if; even though; no matter how
满足,mǎnzú,content; satisfied; to meet (the needs of); to satisfy
承认,chéngrèn,recognition (diplomatic, artistic etc); to acknowledge; to admit; to concede; to recognize
蔬菜,shūcài,vegetables
过期,guòqī,to be overdue; to exceed the time limit; to expire (as in expiration date)
多余,duōyú,superfluous; surplus; unnecessary
稳定,wěndìng,stability; stable; steady; to pacify; to stabilize
疲劳,píláo,fatigue; wearily; weariness; weary
脑袋,nǎodai,brains; head; mental capability; skull
青春,qīngchūn,youth; youthfulness
忽视,hūshì,to neglect; to overlook; to disregard; to ignore
痛苦,tòngkǔ,pain; painful; suffering
课程,kèchéng,academic program; course
逻辑,luóji,logic (loanword)
俱乐部,jùlèbù,club (the organisation or its premises) (loanword)
作品,zuòpǐn,opus; work (of art)
税,shuì,duties; taxes
以及,yǐjí,and; as well as; too
掌握,zhǎngwò,fluency; to control; to grasp (often fig.); to know well; to master; to seize (initiative, opportunity, destiny); to understand sth well and know how to use it
人员,rényuán,crew; personnel; staff
风格,fēnggé,style
酒吧,jiǔbā,bar; pub; saloon
夏令营,xiàlìngyíng,summer camp
账户,zhànghù,bank account; online account
情景,qíngjǐng,circumstances; scene; situation; spectacle
如何,rúhé,how; what; what way
物理,wùlǐ,physical; physics
尾巴,wěiba,colloquial pr. [yi3 ba5]; tail
炒,chǎo,to fire (sb); to hype; to sauté; to speculate; to stir-fry
瞧,qiáo,to look at; to see; to see (a doctor); to visit
婚姻,hūnyīn,marriage; matrimony; wedding
请求,qǐngqiú,request (CL:個|个[ge4]); to request; to ask
位置,wèizhi,place; position; seat
劳驾,láojià,excuse me
贡献,gòngxiàn,contribution; to contribute; to dedicate; to devote
广大,guǎngdà,(of an area) vast or extensive; (of people) numerous; large-scale; widespread
演讲,yǎnjiǎng,lecture; to make a speech
心脏,xīnzàng,heart
握手,wòshǒu,to shake hands
主任,zhǔrèn,director; head
标点,biāodiǎn,a punctuation mark; punctuation; to punctuate
恢复,huīfù,to recover; to regain; to rehabilitate; to reinstate; to restore; to resume
赶紧,gǎnjǐn,hurriedly; without delay
字母,zìmǔ,letter (of the alphabet)
改进,gǎijìn,improvement; to improve; to make better
多亏,duōkuī,luckily; thanks to
消费,xiāofèi,to consume; to spend
堆,duī,a mass; heap; large amount; pile; stack; to heap up; to pile up
乙,yǐ,ancient Chinese compass point: 105°; bent; ethyl; letter "B" or Roman "II" in list "A, B, C", or "I, II, III" etc; second in order; second of the ten Heavenly Stems 十天干[shi2 tian1 gan1]; second party (in legal contract, usually 乙方[yi3 fang1], as opposed to 甲方[jia3 fang1]); winding
乙,zhé,turning stroke (in Chinese characters), aka 折[zhe2]
干脆,gāncuì,candid; direct and to the point; just; might as well; simply
样式,yàngshì,style; type
失业,shīyè,to lose one's job; unemployment
届,jiè,classifier for events, meetings, elections, sporting fixtures, years (of graduation); period; to arrive at (place or time); to become due
绳子,shéngzi,cord; string; rope
辣椒,làjiāo,chili; hot pepper
毕竟,bìjìng,after all; all in all; in the final analysis; when all is said and done
爱心,àixīn,care for others; charity (bazaar, golf day etc); compassion; heart (the symbol ♥); kindness; love
破产,pòchǎn,bankruptcy; to become impoverished; to go bankrupt
明显,míngxiǎn,clear; distinct; obvious
吃亏,chīkuī,to be at a disadvantage; to come to grief; to get the worst of it; to lose out; to suffer losses; unfortunately
退休,tuìxiū,to retire (from the workforce); to go into retirement
亲爱,qīnài,beloved; darling; dear
难怪,nánguài,(it's) no wonder (that...); (it's) not surprising (that)
年纪,niánjì,age
前途,qiántú,future outlook; journey; prospects
太太,tàitai,Madam; Mrs.; married woman; wife
保存,bǎocún,to conserve; to keep; to preserve; to save (a file etc) (computing)
吻,wěn,kiss; mouth; to kiss
恭喜,gōngxǐ,(interj.) congratulations!; to congratulate
耽误,dānwu,to delay; to hold up; to interfere with; to waste time
设施,shèshī,facilities; installation
公主,gōngzhǔ,princess
巧妙,qiǎomiào,ingenious; clever; ingenuity; artifice
中心,zhōngxīn,center; core; heart
信号,xìnhào,signal
蜜蜂,mìfēng,bee; honeybee
装修,zhuāngxiū,interior decoration; to decorate; to fit up; to renovate
结构,jiégòu,architecture; composition; makeup; structure
效率,xiàolü,efficiency
结账,jiézhàng,to pay the bill; to settle accounts
发言,fāyán,statement; to make a speech; utterance
挑战,tiǎozhàn,challenge; to challenge
一致,yīzhì,identical (views or opinions); unanimous
忽然,hūrán,suddenly; all of a sudden
悲观,bēiguān,pessimistic
说不定,shuōbudìng,can't say for sure; maybe
扩大,kuòdà,to broaden one's scope; to enlarge; to expand
消失,xiāoshī,to disappear; to fade away
特征,tèzhēng,characteristic; diagnostic property; distinctive feature; trait
海鲜,hǎixiān,seafood
收据,shōujù,receipt
类型,lèixíng,(computer programming) type; type; kind; category
沉默,chénmò,silent; taciturn; uncommunicative
资料,zīliào,data; information; material; profile (Internet); resources
实用,shíyòng,applied (science); functional; practical; pragmatic
危害,wēihài,damage; harmful effect; to endanger; to harm; to jeopardize
化学,huàxué,chemical; chemistry
雷,léi,(Tw) (coll.) spoiler; (Tw) (coll.) to reveal plot details to (sb); (bound form) (military) mine, as in 地雷[di4 lei2] land mine; (coll.) to shock; to stun; to astound; thunder
逃避,táobì,to avoid; to escape; to evade; to shirk
发抖,fādǒu,to shake; to shiver; to tremble
交际,jiāojì,communication; social intercourse
度过,dùguò,to get through; to pass; to spend (time); to survive
不耐烦,bùnàifán,impatient; to lose patience
狮子,Shīzǐ,Leo (star sign); Shihtzu township in Pingtung County 屏東縣|屏东县[Ping2 dong1 Xian4], Taiwan
狮子,shīzi,lion
工具,gōngjù,instrument; means (to achieve a goal etc); tool; utensil
完善,wánshàn,(of systems, facilities etc) comprehensive; excellent; to improve; to refine; well-developed
体会,tǐhuì,experience; to know from experience; to learn through experience; to realize; understanding
窄,zhǎi,badly off; narrow; narrow-minded
包裹,bāoguǒ,bundle; package; parcel; to bind up; to wrap up
倒霉,dǎoméi,to be out of luck; to have bad luck
志愿者,zhìyuànzhě,volunteer
缓解,huǎnjiě,to alleviate (a crisis); to bring relief; to dull (a pain)
风景,fēngjǐng,scenery; landscape
无所谓,wúsuǒwèi,cannot be said to be; not to matter; to be indifferent
动画片,dònghuàpiàn,animated film
电台,diàntái,broadcasting station; radio station; transmitter-receiver
围绕,wéirào,to center on (an issue); to revolve around
恶劣,èliè,nasty; of very poor quality; vile
部门,bùmén,branch; department; division; section
程序,chéngxù,computer program; order; procedures; sequence
形式,xíngshì,form; formality; outer appearance; shape
数据,shùjù,data
权利,quánlì,(classical) power and wealth; right (i.e. an entitlement to sth)
土地,tǔdi,genius loci; local god
土地,tǔdì,land; soil; territory
摸,mō,to abstract; to feel with the hand; to grope; to steal; to stroke; to touch
缺乏,quēfá,to lack; to be short of
依然,yīrán,as before; still
推荐,tuījiàn,recommendation; to recommend
长途,chángtú,long distance
零食,língshí,between-meal nibbles; snacks
高级,gāojí,advanced; high grade; high level; high-ranking
老婆,lǎopó,(coll.) wife
极其,jíqí,extremely
肩膀,jiānbǎng,shoulder
保留,bǎoliú,to have reservations (about sth); to hold back (from saying sth); to keep; to put aside for later; to retain
假如,jiǎrú,if
念,niàn,idea; remembrance; to attend (a school); to give (sb) a tongue-lashing (CL:頓|顿[dun4]); to miss (sb); to read; to read aloud; to study (a subject); twenty (banker's anti-fraud numeral corresponding to 廿[nian4])
手套,shǒutào,glove; mitten
空间,kōngjiān,(astronomy) outer space; (fig.) scope; leeway; (physics, math.) space; space; room
宽,kuān,broad; lenient; loose; relaxed; wide
耳环,ěrhuán,earring
肌肉,jīròu,flesh; muscle
不安,bùān,disturbed; restless; uneasy; unpeaceful; unstable; worried
推辞,tuīcí,to decline (an appointment, invitation etc)
撕,sī,to tear
迅速,xùnsù,fast; rapid; speedy
享受,xiǎngshòu,pleasure; to enjoy; to live it up
转告,zhuǎngào,to communicate; to pass on; to transmit
浇,jiāo,to cast (molten metal); to irrigate (using waterwheel); to mold; to pour liquid; to water
对待,duìdài,to treat; treatment
制造,zhìzào,to manufacture; to make
灾害,zāihài,calamity; disaster
甩,shuǎi,to dump (sb); to fling; to leave behind; to swing; to throw; to throw off
不见得,bùjiànde,not likely; not necessarily
双方,shuāngfāng,bilateral; both parties involved; both sides
火柴,huǒchái,match (for lighting fire)
充满,chōngmǎn,brimming with; full of; permeated; very full
传播,chuánbō,to disseminate; to propagate; to spread
论文,lùnwén,paper; thesis; to discuss a paper or thesis (old); treatise
着火,zháohuǒ,to catch fire
专心,zhuānxīn,to focus one's attention; to concentrate on (doing sth)
文学,wénxué,literature
蹲,dūn,to crouch; to squat; to stay (somewhere)
屋子,wūzi,house; room
玉米,yùmǐ,corn; maize
取消,qǔxiāo,cancellation; to cancel
临时,línshí,ad hoc; as the time draws near; at the last moment; interim; temporary
利息,lìxī,interest (on a loan)
曾经,céngjīng,(past tense marker used before verb or clause); already; ever; former; once; previously
命运,mìngyùn,fate; destiny
元旦,Yuándàn,New Year's Day
学问,xuéwèn,knowledge; learning
亲切,qīnqiè,amiable; close and dear; cordial; familiar
敌人,dírén,enemy
吵架,chǎojià,quarrel; to have a row; to quarrel
老实,lǎoshi,honest; sincere; naive; gullible; well-behaved
矛盾,máodùn,conflicting views; contradiction; contradictory
身份,shēnfèn,aspect of one's identity (i.e. sth that one is – mayor, father, permanent resident etc); capacity (as in "in his capacity as a ..." 以…的身份[yi3 xx5 de5 shen1 fen4]); identity; position; rank; role; status (social, legal etc)
持续,chíxù,preservation; sustainable; to continue; to last; to persist
根本,gēnběn,(not) at all; absolutely (not); basic; fundamental; root; simply
成立,chénglì,to be tenable; to establish; to hold water; to set up
随手,suíshǒu,conveniently; in passing; while doing it; without extra trouble
工厂,gōngchǎng,factory
烫,tàng,scalding hot; to blanch (cooking); to burn (by scalding); to heat (sth) up in hot water; to iron; to perm; to scald
农村,nóngcūn,rural area; village
统一,tǒngyī,to unify; to integrate; unified; integrated
燃烧,ránshāo,combustion; flaming; to burn; to combust; to ignite
人才,réncái,attractive looks; looks; talent; talented person
未必,wèibì,maybe not; not necessarily
淡,dàn,diluted; indifferent; insipid; light in color; mild; tasteless; weak
建立,jiànlì,to establish; to found; to set up
妇女,fùnü,woman
厘米,límǐ,centimeter
自觉,zìjué,aware; conscientious; conscious; on one's own initiative
占,zhān,to divine; to observe
占,zhàn,to occupy; to take possession of; to take up
把握,bǎwò,assurance; certainty; sure (of the outcome); to grasp (also fig.); to hold; to seize
卡车,kǎchē,truck
朗读,lǎngdú,to read aloud
软,ruǎn,flexible; soft
市场,shìchǎng,market (also in abstract); marketplace
湿润,shīrùn,moist
能源,néngyuán,energy; power source
至今,zhìjīn,so far; to this day; until now
单元,dānyuán,(in a residential building) entrance or staircase; element; unit (forming an entity)
抄,chāo,to fold one's arms; to go off with; to grab; to make a copy; to make a turning move; to plagiarize; to raid; to search and seize; to take a shortcut
豪华,háohuá,luxurious
训练,xùnliàn,to drill; to train; training
拍,pāi,beat (music); racket (sports); to clap; to pat; to shoot (a film); to slap; to swat; to take (a photo)
美术,měishù,art; fine arts; painting
产生,chǎnshēng,to arise; to come into being; to come about; to give rise to; to bring into being; to bring about; to produce; to engender; to generate
肥皂,féizào,soap
列车,lièchē,(railway) train
大象,dàxiàng,elephant
劝,quàn,to advise; to console; to exhort; to soothe; to try to persuade; to urge
程度,chéngdù,degree; level; extent
相当,xiāngdāng,appropriate; considerably; equivalent to; fairly; quite; to a certain extent
玩具,wánjù,plaything; toy
单调,dāndiào,monotonous
追,zhuī,posthumously; retroactively; to binge-watch (a TV drama); to chase; to court (one's beloved); to investigate; to look into; to pursue; to recall; to reminisce
追,duī,musical instrument (old); to carve; to sculpt
以来,yǐlái,since (a previous event)
唯一,wéiyī,only; sole
寻找,xúnzhǎo,to seek; to look for
锁,suǒ,a lock (CL:把[ba3]); to lock; to lock up
包括,bāokuò,to comprise; to consist of; to include; to incorporate; to involve
坚决,jiānjué,firm; resolute; determined
个人,gèrén,individual; oneself; personal
推广,tuīguǎng,generalization; promotion (of a product etc); to extend; to popularize; to spread
感受,gǎnshòu,a feeling; an experience; an impression; perception; to experience; to feel (through the senses); to sense
拦,lán,to block sb's path; to flag down (a taxi); to obstruct
从事,cóngshì,to deal with; to do; to engage in; to go for; to handle; to undertake
从而,cóngér,thereby; thus
乐器,yuèqì,musical instrument
随身,suíshēn,to (carry) on one's person; to (take) with one
书架,shūjià,bookshelf
土豆,tǔdòu,(Tw) peanut (CL:顆|颗[ke1]); potato (CL:個|个[ge4])
鼠标,shǔbiāo,mouse (computing)
体验,tǐyàn,to experience for oneself
调皮,tiáopí,mischievous; naughty; unruly
议论,yìlùn,discussion; to comment; to discuss; to talk about
可见,kějiàn,clear; it can clearly be seen (that this is the case); it is (thus) clear; visible
经典,jīngdiǎn,classic (example, case etc); classical; scriptures; the classics; typical
空闲,kòngxián,free time; idle; leisure; unused (place)
种类,zhǒnglèi,category; class; genus; kind; sort; species; type; variety
浏览,liúlǎn,to browse; to skim over
家务,jiāwù,household duties; housework
贷款,dàikuǎn,a loan; to provide a loan (e.g. bank); to raise a loan (from e.g. a bank)
称呼,chēnghu,form of address; appellation; to call; to address as
弱,ruò,(following a decimal or fraction) slightly less than; inferior; not as good as; weak; feeble; young
分手,fēnshǒu,to break up; to part company; to split up
唉,āi,interjection or grunt of agreement or recognition (e.g. yes, it's me!); to sigh
唉,ài,alas; oh dear
伤害,shānghài,to harm; to injure
灵活,línghuó,agile; flexible; nimble
大方,dàfang,easy-mannered; generous; in good taste; magnanimous; natural and relaxed; stylish
大方,dàfāng,a type of green tea; expert; mother earth; scholar
阵,zhèn,burst; classifier for events or states of short duration; disposition of troops; short period of time; spate; spell; wave
叙述,xùshù,account; narration; narrative; telling; to recount; to relate (a story or information); to tell or talk about
急忙,jímáng,hastily
商务,shāngwù,business; commerce; commercial; commercial affairs
领导,lǐngdǎo,lead; leader; leadership; leading; to lead
滴,dī,a drop; to drip
不如,bùrú,inferior to; it would be better to; not as good as; not equal to
反而,fǎnér,on the contrary; instead
投资,tóuzī,investment; to invest
罚款,fákuǎn,fine (monetary); penalty; to fine
难免,nánmiǎn,difficult to escape from; hard to avoid; will inevitably
试卷,shìjuàn,examination paper; test paper
碎,suì,(transitive or intransitive verb) to break into pieces; to shatter; to crumble; broken; fragmentary; scattered; garrulous
本质,běnzhì,essence; innate character; intrinsic quality; nature
构成,gòuchéng,to compose; to configure (computing); to constitute; to form; to make up
否认,fǒurèn,to declare to be untrue; to deny
文明,wénmíng,civilization; civilized; culture
纪念,jìniàn,memento; keepsake; souvenir; to commemorate; to honor the memory of
主席,zhǔxí,chairman; chairperson; premier
便,biàn,convenient; equivalent to 就[jiu4]: then; even if; in that case; informal; opportune; plain; soon afterwards; suitable; to urinate or defecate
拼音,pīnyīn,phonetic writing; pinyin (Chinese romanization)
时代,shídài,age; epoch; era; period (in one's life)
时代,Shídài,Time, US weekly news magazine
中介,zhōngjiè,agency; agent; inter-; intermediate; to act as intermediary; to link
腰,yāo,loins; lower back; middle; pocket; waist
抓,zhuā,to arrest; to catch; to grab; to scratch; to snatch
哎,āi,(interjection used to attract attention or to express surprise or disapprobation); hey!
集中,jízhōng,centralized; concentrated; to centralize; to concentrate; to focus; to put together
不要紧,bùyàojǐn,it doesn't matter; it looks all right, but; never mind; not serious; unimportant
醋,cù,jealousy (in love rivalry); vinegar
利益,lìyì,(in sb's) interest; benefit
彼此,bǐcǐ,each other; one another
道理,dàoli,argument; basis; justification; principle; reason; sense
总裁,zǒngcái,chairman; director-general (of a company etc)
应用,yìngyòng,(computing) app; application; applied (science, linguistics etc); practical; practical use; to apply; to put to use
表现,biǎoxiàn,behavior; display; expression; manifestation; performance (at work etc); show; to display; to manifest; to show; to show off
梨,lí,pear
连忙,liánmáng,at once; promptly
挣,zhèng,to make (money); to strive to acquire; to struggle to get free
无奈,wúnài,(conjunction) but unfortunately; exasperated; frustrated; helpless; to have no alternative
迫切,pòqiè,urgent; pressing
收获,shōuhuò,bonus; crop; gain; harvest; profit; reward; to gain; to harvest; to reap
果实,guǒshí,(fig.) fruits (of success etc); fruit (produced by a plant); gains; results
拆,chāi,to open; to tear apart; to tear down; to tear open
抽象,chōuxiàng,abstract; abstraction
铃,líng,(small) bell
何必,hébì,there is no need; why should
搞,gǎo,to do; to get hold of; to go in for; to make; to set up; to take care of
规律,guīlü,discipline; law of behavior; regular pattern; rhythm; rule (e.g. of science)
个性,gèxìng,individuality; personality
哲学,zhéxué,philosophy
划,huà,stroke of a Chinese character; to assign; to delimit; to draw (a line); to plan; to transfer
划,huá,to cut; to scratch (cut into the surface of sth); to slash; to strike (a match)
划,huá,it pays (to do sth); profitable; to paddle; to row; worth (the effort)
简直,jiǎnzhí,simply; really
写作,xiězuò,to compose; to write; writing; written works
能干,nénggàn,capable; competent
娱乐,yúlè,amusement; entertainment; fun; hobby; joy; recreation; to amuse; to entertain
宠物,chǒngwù,house pet
浅,qiǎn,light (color); shallow
浅,jiān,sound of moving water
废话,fèihuà,No kidding! (gently sarcastic); You don't say!; nonsense; rubbish; superfluous words
用途,yòngtú,use; application
平安,píngān,at peace; quiet and safe; safe and sound; well; without mishap
代替,dàitì,to replace; to take the place of
目录,mùlù,catalog; contents; directory (on computer hard drive); list; table of contents
实践,shíjiàn,practice; to carry out (a project); to live up to (a promise); to put into practice
微笑,wēixiào,smile; to smile
吐,tù,to throw up; to vomit
吐,tǔ,to pour out (one's grievances); to say; to send out (silk from a silkworm, bolls from cotton flowers etc); to spit
宁可,nìngkě,(to pick) the lesser of two evils; (would) be better to; one would prefer to...(or not to...); preferably; would rather
召开,zhàokāi,to call together; to convene (a conference or meeting); to convoke
嗯,ēn,(a groaning sound)
嗯,en,interjection indicating approval, appreciation or agreement
嗯,èn,(nonverbal grunt as interjection); OK, yeah; what?
处理,chǔlǐ,to handle; to deal with; to punish; to sell at reduced prices; to treat sth by a special process; to process
鞭炮,biānpào,firecrackers; string of small firecrackers
会计,kuàijì,accountancy; accountant; accounting
作为,zuòwéi,accomplishment; achievement; activity; as (in the capacity of); deed; one's conduct; qua; to act as; to look upon (sth as); to take sth to be; to view as
移动,yídòng,migration; mobile; movement; portable; to move
思想,sīxiǎng,idea; ideology; thinking; thought
完美,wánměi,perfect
转变,zhuǎnbiàn,shift; to change; to transform; transformation
讲究,jiǎngjiu,carefully selected for quality; tastefully chosen; to pay particular attention to
老鼠,lǎoshǔ,mouse; rat
彩虹,cǎihóng,rainbow
地理,dìlǐ,geography
姑姑,gūgu,paternal aunt
话题,huàtí,subject (of a talk or conversation); topic
缩短,suōduǎn,to curtail; to cut down
结合,jiéhé,binding; to combine; to integrate; to link
假设,jiǎshè,conjecture; hypothesis; if; supposing that ...; to assume; to presume; to suppose
的确,díquè,indeed; really
博物馆,bówùguǎn,museum
培训,péixùn,to cultivate; to groom; to train; training
删除,shānchú,to cancel; to delete
怪不得,guàibude,no wonder!; so that's why!
预订,yùdìng,to book ahead; to place an order
一律,yīlü,all; same; uniformly; without exception
被子,bèizi,quilt
平常,píngcháng,common; ordinarily; ordinary; usually
文字,wénzì,character; phraseology; script; writing; writing style; written language
朵,duǒ,classifier for flowers, clouds etc; earlobe; fig. item on both sides; flower
深刻,shēnkè,deep; deep-going; profound
孝顺,xiàoshùn,devoted to one's parents (and grandparents etc); dutiful; filial; filial piety; to show filial piety towards (an older family member)
高档,gāodàng,high grade; superior quality; top grade
退,tuì,to decline; to reject; to return (sth); to retreat; to withdraw
则,zé,(bound form) principle; (bound form) standard; norm; (literary) (conjunction used to express contrast with a previous clause) but; then; (literary) to imitate; to follow; classifier for written items
规模,guīmó,extent; scale; scope
外公,wàigōng,(coll.) mother's father; maternal grandfather
格外,géwài,especially; particularly
陌生,mòshēng,strange; unfamiliar
参与,cānyù,to participate (in sth)
慌张,huāngzhāng,agitated; flustered
调整,tiáozhěng,adjustment; revision; to adjust
自从,zìcóng,ever since; since (a time)
确定,quèdìng,OK (on computer dialog box); certain; definite; fixed; to ascertain; to be sure; to clinch; to confirm; to determine; to ensure; to fix (on sth); to make certain; to recognize
总理,zǒnglǐ,premier; prime minister
实习,shíxí,field work; internship; to intern; to practice
摩托车,mótuōchē,(loanword) motorbike; motorcycle
时尚,shíshàng,fad; fashion; fashionable
上当,shàngdàng,taken in (by sb's deceit); to be duped; to be fooled
采访,cǎifǎng,to cover; to gather news; to hunt for and collect; to interview
广泛,guǎngfàn,extensive; wide range
相关,xiāngguān,(statistics) correlation; pertinent; related; relevant; to be interrelated
喊,hǎn,to call out for (a person); to shout; to yell
包含,bāohán,to contain; to embody; to include
吸取,xīqǔ,to absorb; to assimilate; to draw (a lesson, insight etc)
用功,yònggōng,diligent; industrious (in one's studies); to make great effort; to study hard
拥抱,yōngbào,to embrace; to hug
竹子,zhúzi,bamboo
灰,huī,ash; discouraged; dejected; dust; gray; lime
合影,héyǐng,group photo; to take a joint photo
奋斗,fèndòu,to strive; to struggle
光明,guāngmíng,(fig.) bright (prospects etc); light; openhearted; radiance
球迷,qiúmí,fan (ball sports)
设备,shèbèi,equipment; facilities; installations
电池,diànchí,battery
偶然,ǒurán,by chance; incidentally; occasional; occasionally; randomly
赞成,zànchéng,(literary) to assist; to approve; to endorse
地道,dìdào,causeway; tunnel
地道,dìdao,authentic; genuine; proper
兔子,tùzi,hare; rabbit
岛屿,dǎoyǔ,island
挂号,guàhào,to register (at a hospital etc); to send by registered mail
操场,cāochǎng,drill ground; playground; sports field
阻止,zǔzhǐ,to block; to prevent
自愿,zìyuàn,voluntary
绕,rào,to by-pass; to go round (an obstacle); to make a detour; to move around; to spiral
绕,rào,to by-pass; to coil (thread); to confuse; to go round (an obstacle); to make a detour; to move around; to perplex; to rotate around; to spiral; to wind
女士,nüshì,Miss; Ms; lady; madam
消极,xiāojí,inactive; negative; passive
教练,jiàoliàn,instructor; sports coach; trainer
色彩,sècǎi,(fig.) flavor; character; tint; coloring; coloration
在乎,zàihu,equivalent of 在於|在于[zai4 yu2]; to care about
辩论,biànlùn,argument; debate; to argue over
胡同,hútòng,alley; lane
手指,shǒuzhǐ,finger
壶,hú,classifier for bottled liquid; pot
心理,xīnlǐ,mentality; psychology
谨慎,jǐnshèn,cautious; prudent
