闪电,shǎndiàn,lightning
建设,jiànshè,to build; to construct; to establish; to develop; to institute
滚,gǔn,Get lost!; to boil; to roll; to take a hike
在于,zàiyú,to be in; to consist in; to depend on; to lie in; to rest with
商业,shāngyè,business; commerce; trade
预报,yùbào,forecast
个别,gèbié,individually; one by one; just one or two; exceptional; rare
枪,qiāng,rifle; spear
枪,qiāng,classifier for rifle shots; firearm; gun; rifle; spear; thing with shape or function similar to a gun; to knock; to substitute for another person in a test
各自,gèzì,apiece; each; respective
办理,bànlǐ,to handle; to transact; to conduct
简历,jiǎnlì,biographical notes; curriculum vitae (CV); résumé
敏感,mǐngǎn,sensitive; susceptible
物质,wùzhì,material; materialistic; matter; substance
独特,dútè,unique; distinctive
录取,lùqǔ,to accept an applicant (prospective student, employee etc) who passes an entrance exam; to admit (a student); to hire (a job candidate)
粗糙,cūcāo,coarse; crude; gruff; rough
核心,héxīn,core; nucleus
武术,wǔshù,all kinds of martial art sports (some claiming spiritual development); also called kungfu 功夫; military skill or technique (in former times); self-defense; tradition of choreographed fights from opera and film (recent usage)
热心,rèxīn,enthusiastic; ardent; zealous
超级,chāojí,hyper-; super-; ultra-
要不,yàobù,either... (or...); how about...?; or else; otherwise
胸,xiōng,bosom; chest; heart; mind; thorax
必要,bìyào,essential; indispensable; necessary; required
明确,míngquè,clear-cut; definite; explicit; to clarify; to specify; to make definite
文件,wénjiàn,document; file
时期,shíqī,period; phase
凭,píng,no matter (how, what etc); on the basis of; proof; to lean against; to rely on
与其,yǔqí,rather than...; 與其|与其[yu3 qi2] A 不如[bu4 ru2] B (rather than A, better to B)
着凉,zháoliáng,to catch cold
兄弟,xiōngdì,I, me (humble term used by men in public speech); brotherly; brothers; fraternal; younger brother
无数,wúshù,countless; innumerable; numberless
讨价还价,tǎojiàhuánjià,to bargain; to haggle over price
固定,gùdìng,fixed; regular; set; to fasten; to fix; to set rigidly in place
傍晚,bàngwǎn,at dusk; at night fall; in the evening; towards evening; when night falls
热爱,rèài,to adore; to love ardently
证据,zhèngjù,evidence; proof; testimony
当心,dāngxīn,to look out; to take care
形成,xíngchéng,to form; to take shape
称,chēng,appellation; name; to name; to praise; to state; to weigh
称,chèng,steelyard
称,chèn,balanced; suitable; to fit
相处,xiāngchǔ,to associate; to be in contact (with sb); to get along (well, poorly); to interact
气氛,qìfēn,atmosphere; mood
宣布,xuānbù,to announce; to declare; to proclaim
隔壁,gébì,neighbor; next door
风险,fēngxiǎn,risk; hazard
代表,dàibiǎo,delegate; in the name of; on behalf of; representative; to represent; to stand for
香肠,xiāngcháng,sausage
蛇,shé,serpent; snake
征求,zhēngqiú,to petition; to request (opinions, feedback etc); to seek; to solicit
传统,chuántǒng,convention; conventional; tradition; traditional
威胁,wēixié,to threaten; to menace
农民,nóngmín,farmer; peasant
艰苦,jiānkǔ,arduous; difficult; hard
逗,dòu,(coll.) funny; amusing; (coll.) to joke; to stay; to sojourn; to tease (playfully); to entice
状态,zhuàngtài,condition; state; state of affairs
漏,lòu,to divulge; to leak; to leave out by mistake; waterclock or hourglass (old)
针对,zhēnduì,in response to; to be aimed at or against; to focus on; to target
淘气,táoqì,mischievous; naughty
银,yín,relating to money or currency; silver; silver-colored
幼儿园,yòuéryuán,kindergarten; nursery school
整体,zhěngtǐ,as a whole (situation, construction, team etc); entire body; global; holistic; integral; macrocosm; synthesis; whole; whole entity
海关,hǎiguān,customs (i.e. border crossing inspection)
射击,shèjī,to fire (a gun); to shoot
原则,yuánzé,doctrine; principle
规则,guīzé,regulation; rule; rules and regulations
采取,cǎiqǔ,to adopt or carry out (measures, policies, course of action); to take
自私,zìsī,selfish; selfishness
硬件,yìngjiàn,hardware
舍不得,shěbude,to begrudge; to hate to do sth; to hate to part with
组成,zǔchéng,to constitute; to form; to make up
幅,fú,classifier for textiles or pictures; roll; width
保险,bǎoxiǎn,be bound to; be sure; insurance; safe; secure; to insure
方式,fāngshì,way; manner; style; mode; pattern
砍,kǎn,to chop; to cut down; to throw sth at sb
纪律,jìlü,discipline
插,chā,pierce; stick in; to insert; to interfere; to interpose; to take part in
传说,chuánshuō,legend; folk tale; to repeat from mouth to mouth; they say that...
反复,fǎnfù,(of an illness) to return; over and over; repeatedly; to come and go; to upend; unstable
分析,fēnxī,analysis; to analyze
片,piān,disk; sheet
片,piàn,TV play; a slice; classifier for CDs, movies, DVDs etc; classifier for slices, tablets, tract of land, area of water; film; flake; incomplete; one-sided; partial; thin piece; to carve thin; to slice; used with numeral 一[yi1]: classifier for scenario, scene, feeling, atmosphere, sound etc
赶快,gǎnkuài,quickly; at once
不足,bùzú,cannot; deficiency; inadequate; insufficient; lacking; not enough; not worth; should not